{
  "$schema": "https://json-schema.org/draft/2020-12/schema",
  "type": "object",
  "additionalProperties": false,
  "required": [
    "schema_version",
    "id",
    "title",
    "fields",
    "actions"
  ],
  "properties": {
    "schema_version": {
      "const": 1
    },
    "id": {
      "type": "string",
      "pattern": "^[a-z][a-z0-9_-]*$"
    },
    "title": {
      "type": "string",
      "minLength": 1
    },
    "fields": {
      "type": "array",
      "items": {
        "type": "object",
        "additionalProperties": false,
        "required": [
          "id",
          "type",
          "label"
        ],
        "properties": {
          "id": {
            "type": "string",
            "pattern": "^[a-z][a-z0-9_-]*$"
          },
          "type": {
            "enum": [
              "text",
              "file",
              "checkbox",
              "select"
            ]
          },
          "label": {
            "type": "string",
            "minLength": 1
          },
          "required": {
            "type": "boolean"
          },
          "options": {
            "type": "array",
            "minItems": 1,
            "uniqueItems": true,
            "items": {
              "type": "string"
            }
          }
        },
        "allOf": [
          {
            "if": {
              "properties": {
                "type": {
                  "const": "select"
                }
              }
            },
            "then": {
              "required": [
                "options"
              ]
            },
            "else": {
              "not": {
                "required": [
                  "options"
                ]
              }
            }
          }
        ]
      }
    },
    "actions": {
      "type": "array",
      "minItems": 1,
      "items": {
        "type": "object",
        "additionalProperties": false,
        "required": [
          "id",
          "label",
          "action"
        ],
        "properties": {
          "id": {
            "type": "string",
            "pattern": "^[a-z][a-z0-9_-]*$"
          },
          "label": {
            "type": "string",
            "minLength": 1
          },
          "action": {
            "enum": [
              "open_files",
              "save_playlist",
              "load_playlist",
              "cancel"
            ]
          }
        }
      }
    }
  }
}
